{
  "$schema": "http://json-schema.org/draft-07/schema#",
  "$id": "https://gradience.local/schemas/run_metadata.schema.json",
  "title": "Run Metadata",
  "description": "Metadata for a single condition run. Emitted by GPU-side inference, validated by CPU-side normalizer (04_normalize_outputs.py). See SPEC_CPU_v0_2.md §5.2.",
  "type": "object",
  "required": [
    "run_id",
    "condition_id",
    "model_id",
    "hf_name",
    "benchmark_id",
    "prompt_id",
    "fewshot_k",
    "scoring_rule_id",
    "task_type",
    "num_items_expected",
    "num_items_completed",
    "inference_backend",
    "python_version",
    "transformers_version",
    "torch_version",
    "device",
    "dtype",
    "started_at",
    "finished_at",
    "status"
  ],
  "properties": {
    "run_id":                {"type": "string"},
    "condition_id":          {"type": "string"},
    "model_id":              {"type": "string"},
    "hf_name":               {"type": "string"},
    "hf_revision":           {"type": "string"},
    "benchmark_id":          {"type": "string"},
    "subject_id":            {"type": ["string", "null"]},
    "prompt_id":             {"type": "string"},
    "seed_id":               {"type": ["string", "null"]},
    "fewshot_k":             {"type": "integer", "minimum": 0},
    "scoring_rule_id":       {"type": "string"},
    "task_type":             {"type": "string", "enum": ["constrained_choice", "open_generation"]},
    "num_items_expected":    {"type": "integer", "minimum": 1},
    "num_items_completed":   {"type": "integer", "minimum": 0},
    "inference_backend":     {"type": "string"},
    "python_version":        {"type": "string"},
    "transformers_version":  {"type": "string"},
    "torch_version":         {"type": "string"},
    "lm_eval_version":       {"type": ["string", "null"]},
    "device":                {"type": "string"},
    "dtype":                 {"type": "string"},
    "started_at":            {"type": "string", "format": "date-time"},
    "finished_at":           {"type": "string", "format": "date-time"},
    "status":                {"type": "string", "enum": ["complete", "failed", "partial"]},
    "notes":                 {"type": "string"}
  },
  "additionalProperties": false
}
