{
  "benchmark_id": "arc_challenge",
  "condition_id": "arc_challenge__pythia_410m__P1_original__s42__ll_norm",
  "device": "cpu",
  "dtype": "float32",
  "fewshot_k": 5,
  "finished_at": "2026-04-24T00:00:10+00:00",
  "hf_name": "EleutherAI/pythia-410m",
  "hf_revision": "fixture_revision_hash",
  "inference_backend": "local_transformers",
  "lm_eval_version": null,
  "model_id": "pythia_410m",
  "notes": "",
  "num_items_completed": 4,
  "num_items_expected": 4,
  "prompt_id": "P1_original",
  "python_version": "3.11.6",
  "run_id": "arc_challenge__pythia_410m__P1_original__s42__ll_norm",
  "scoring_rule_id": "ll_norm",
  "seed_id": "42",
  "started_at": "2026-04-24T00:00:00+00:00",
  "status": "complete",
  "subject_id": null,
  "task_type": "constrained_choice",
  "torch_version": "2.1.0",
  "transformers_version": "4.44.0"
}
